{
  "$schema": "https://json-schema.org/draft/2020-12/schema",
  "$id": "https://ldktech.dev/schemas/linear-project-update.schema.json",
  "title": "Linear Project Update",
  "type": "object",
  "additionalProperties": false,
  "required": ["schemaVersion", "kind", "mode", "projectId", "health", "summary", "progress", "risks", "nextSteps", "evidence"],
  "properties": {
    "schemaVersion": { "const": 1 },
    "kind": { "const": "linear-project-update" },
    "mode": { "enum": ["preview", "publish"] },
    "projectId": { "type": "string", "minLength": 1 },
    "health": { "enum": ["on-track", "at-risk", "off-track"] },
    "summary": { "type": "string", "minLength": 1 },
    "progress": { "type": "array", "items": { "type": "string", "minLength": 1 } },
    "risks": { "type": "array", "items": { "type": "string", "minLength": 1 } },
    "nextSteps": { "type": "array", "minItems": 1, "items": { "type": "string", "minLength": 1 } },
    "evidence": {
      "type": "array",
      "items": {
        "type": "object",
        "additionalProperties": false,
        "required": ["label", "value"],
        "properties": {
          "label": { "type": "string", "minLength": 1 },
          "value": { "type": "string", "minLength": 1 }
        }
      }
    }
  }
}
